[
  {
    "id": "player-sprite",
    "type": "player",
    "name": "Player Sprite",
    "description": "A controllable player character with animation frames, collision detection, and customizable properties. Supports multiple animation states including idle, walking, jumping, and actions.",
    "version": "1.0.0",
    "paramsSchema": {
      "type": "object",
      "properties": {
        "speed": {
          "type": "number",
          "default": 200,
          "minimum": 50,
          "maximum": 500,
          "description": "Movement speed in pixels per second"
        },
        "jumpHeight": {
          "type": "number", 
          "default": 300,
          "minimum": 100,
          "maximum": 600,
          "description": "Jump height in pixels"
        },
        "health": {
          "type": "integer",
          "default": 3,
          "minimum": 1,
          "maximum": 10,
          "description": "Player health points"
        },
        "invulnerabilityTime": {
          "type": "number",
          "default": 1.5,
          "minimum": 0.5,
          "maximum": 5.0,
          "description": "Invulnerability time after taking damage"
        },
        "animationSpeed": {
          "type": "number",
          "default": 0.1,
          "minimum": 0.05,
          "maximum": 0.5,
          "description": "Animation frame duration in seconds"
        }
      },
      "required": ["speed", "jumpHeight", "health"]
    },
    "dependencies": [],
    "assetReferences": [
      {
        "slotId": "idle-sprite",
        "assetType": "sprite",
        "required": true,
        "multiple": false,
        "tags": ["character", "idle", "animation"],
        "defaultAsset": "player-blue-idle"
      },
      {
        "slotId": "walk-sprite",
        "assetType": "sprite", 
        "required": true,
        "multiple": false,
        "tags": ["character", "walk", "animation"],
        "defaultAsset": "player-blue-walk"
      },
      {
        "slotId": "jump-sprite",
        "assetType": "sprite",
        "required": true,
        "multiple": false,
        "tags": ["character", "jump", "animation"],
        "defaultAsset": "player-blue-jump"
      },
      {
        "slotId": "damage-sound",
        "assetType": "sound",
        "required": false,
        "multiple": false,
        "tags": ["damage", "player", "feedback"],
        "defaultAsset": "player-damage-sound"
      }
    ],
    "events": [
      {
        "name": "player_moved",
        "description": "Fired when the player moves to a new position",
        "parameters": {
          "oldPosition": { "type": "object" },
          "newPosition": { "type": "object" },
          "velocity": { "type": "object" }
        }
      },
      {
        "name": "player_jumped",
        "description": "Fired when the player initiates a jump",
        "parameters": {
          "position": { "type": "object" },
          "jumpVelocity": { "type": "number" }
        }
      },
      {
        "name": "player_damaged",
        "description": "Fired when the player takes damage",
        "parameters": {
          "damage": { "type": "number" },
          "newHealth": { "type": "number" },
          "source": { "type": "string" }
        }
      },
      {
        "name": "player_died",
        "description": "Fired when the player's health reaches zero",
        "parameters": {
          "position": { "type": "object" },
          "cause": { "type": "string" }
        }
      }
    ],
    "category": "core",
    "tags": ["player", "character", "controllable", "animated", "collision"],
    "icon": "user",
    "preview": "player-sprite-preview.gif",
    "documentation": {
      "usage": "The Player Sprite component creates a controllable character that responds to input. Configure movement speed, jump height, and health to match your game's feel. Assign sprite assets for different animation states.",
      "examples": [
        {
          "title": "Basic Platformer Player",
          "description": "Standard setup for a 2D platformer",
          "config": {
            "speed": 200,
            "jumpHeight": 300,
            "health": 3,
            "animationSpeed": 0.1
          }
        },
        {
          "title": "Fast-Paced Action Player", 
          "description": "High-speed setup for action games",
          "config": {
            "speed": 400,
            "jumpHeight": 250,
            "health": 5,
            "animationSpeed": 0.08
          }
        }
      ]
    },
    "buildTargets": ["desktop", "web"],
    "createdAt": "2024-01-01T00:00:00.000Z",
    "updatedAt": "2024-01-01T00:00:00.000Z"
  },
  {
    "id": "platform-ground",
    "type": "platform",
    "name": "Platform/Ground",
    "description": "Solid platform component that provides collision surfaces for characters to stand on, jump from, or interact with. Supports different platform types and behaviors.",
    "version": "1.0.0",
    "paramsSchema": {
      "type": "object",
      "properties": {
        "width": {
          "type": "number",
          "default": 128,
          "minimum": 32,
          "maximum": 1024,
          "description": "Platform width in pixels"
        },
        "height": {
          "type": "number",
          "default": 32,
          "minimum": 16,
          "maximum": 256,
          "description": "Platform height in pixels"
        },
        "solid": {
          "type": "boolean",
          "default": true,
          "description": "Whether the platform blocks all movement"
        },
        "oneWayUp": {
          "type": "boolean",
          "default": false,
          "description": "Allow passing through from below"
        },
        "breakable": {
          "type": "boolean",
          "default": false,
          "description": "Can be destroyed by player or enemies"
        },
        "moving": {
          "type": "boolean",
          "default": false,
          "description": "Platform moves according to a pattern"
        },
        "movementSpeed": {
          "type": "number",
          "default": 50,
          "minimum": 10,
          "maximum": 200,
          "description": "Movement speed if platform is moving"
        }
      },
      "required": ["width", "height"]
    },
    "dependencies": [],
    "assetReferences": [
      {
        "slotId": "platform-sprite",
        "assetType": "sprite",
        "required": true,
        "multiple": false,
        "tags": ["platform", "ground", "tile"],
        "defaultAsset": "grass-platform"
      },
      {
        "slotId": "break-sound",
        "assetType": "sound",
        "required": false,
        "multiple": false,
        "tags": ["break", "destruction", "platform"],
        "defaultAsset": "platform-break-sound"
      }
    ],
    "events": [
      {
        "name": "platform_landed",
        "description": "Fired when an entity lands on the platform",
        "parameters": {
          "entity": { "type": "string" },
          "landingForce": { "type": "number" }
        }
      },
      {
        "name": "platform_broken",
        "description": "Fired when a breakable platform is destroyed",
        "parameters": {
          "position": { "type": "object" },
          "destroyer": { "type": "string" }
        }
      }
    ],
    "category": "core",
    "tags": ["platform", "ground", "collision", "solid", "environment"],
    "icon": "square",
    "preview": "platform-preview.png",
    "documentation": {
      "usage": "Platform components provide solid surfaces for gameplay. Configure size, collision behavior, and movement patterns. Essential for platformer games.",
      "examples": [
        {
          "title": "Standard Ground Platform",
          "description": "Basic solid platform for level geometry",
          "config": {
            "width": 128,
            "height": 32,
            "solid": true,
            "oneWayUp": false
          }
        },
        {
          "title": "Jump-Through Platform",
          "description": "Platform you can jump through from below",
          "config": {
            "width": 96,
            "height": 24,
            "solid": true,
            "oneWayUp": true
          }
        }
      ]
    },
    "buildTargets": ["desktop", "web"],
    "createdAt": "2024-01-01T00:00:00.000Z",
    "updatedAt": "2024-01-01T00:00:00.000Z"
  },
  {
    "id": "scrolling-background",
    "type": "background",
    "name": "Scrolling Background",
    "description": "Animated background component that creates depth and atmosphere with parallax scrolling, tiling, and multiple layer support for rich visual environments.",
    "version": "1.0.0",
    "paramsSchema": {
      "type": "object",
      "properties": {
        "scrollSpeed": {
          "type": "number",
          "default": 0.5,
          "minimum": 0,
          "maximum": 2.0,
          "description": "Background scroll speed multiplier"
        },
        "parallaxFactor": {
          "type": "number",
          "default": 0.3,
          "minimum": 0,
          "maximum": 1.0,
          "description": "Parallax effect strength (0=static, 1=same as camera)"
        },
        "tileHorizontally": {
          "type": "boolean",
          "default": true,
          "description": "Repeat background horizontally"
        },
        "tileVertically": {
          "type": "boolean",
          "default": false,
          "description": "Repeat background vertically"
        },
        "opacity": {
          "type": "number",
          "default": 1.0,
          "minimum": 0,
          "maximum": 1.0,
          "description": "Background opacity (0=invisible, 1=opaque)"
        }
      },
      "required": ["scrollSpeed"]
    },
    "dependencies": [],
    "assetReferences": [
      {
        "slotId": "background-image",
        "assetType": "sprite",
        "required": true,
        "multiple": false,
        "tags": ["background", "landscape", "environment"],
        "defaultAsset": "hills-background"
      },